<?xml version="1.0" encoding="utf-8"?>
<xs:schema xmlns:xs="http://www.w3.org/2001/XMLSchema">
    <xs:element name="chatroom">
        <xs:complexType>
            <xs:sequence>
                <xs:element name="chat" minOccurs="1" maxOccurs="1">
                    <xs:complexType>
                        <xs:sequence>
                            <xs:element name="user" minOccurs="1" maxOccurs="unbounded">
                                <xs:complexType>
                                    <xs:sequence>
                                        <xs:element name="name" type="xs:string"/>
                                        <xs:element name="status" type="xs:string"/>
                                        <xs:element name="avatar" minOccurs="0">
                                            <xs:complexType>
                                                <xs:sequence>
                                                    <xs:element name="image" maxOccurs="1">
                                                        <xs:complexType>
                                                            <xs:simpleContent>
                                                                <xs:extension base="xs:string">
                                                                    <xs:attribute name="name" type="xs:string" use="required"/>
                                                                </xs:extension>
                                                            </xs:simpleContent>
                                                        </xs:complexType>
                                                    </xs:element>
                                                </xs:sequence>
                                            </xs:complexType>
                                        </xs:element>
                                        <xs:element name="message" minOccurs="1">
                                            <xs:complexType>
                                                <xs:sequence>
                                                    <xs:element name="submissionTime" type="xs:time"/>
                                                    <xs:element name="text" type="xs:string"/>
                                                </xs:sequence>
                                            </xs:complexType>
                                        </xs:element>
                                    </xs:sequence>
                                <xs:attribute name="id" type="xs:positiveInteger" use="required"/>
                                </xs:complexType>
                            </xs:element>
                        </xs:sequence>
                    <xs:attribute name="id" type="xs:positiveInteger" use="required"/>
                    </xs:complexType>
                </xs:element>
            </xs:sequence>
        </xs:complexType>
    </xs:element>
</xs:schema>